<?xml version="1.0" encoding="UTF-8"?>
<!DOCTYPE Module SYSTEM "http://www.monfox.com/monfox/toolkit/snmp/dtd/snmpMetadata.dtd">
<!--This is an automatically generated file.-->
<!--Do not Edit!-->
<!--[Thu Aug 10 08:11:58 EDT 2017]-->
<Module name="TRANSPORT-ADDRESS-MIB">
   <Requires />
   <ModuleIdentity name="transportAddressMIB" oid="1.3.6.1.2.1.100" lastUpdated="200211010000Z">
      <Organization>IETF Operations and Management Area</Organization>
      <ContactInfo>Juergen Schoenwaelder (Editor)
TU Braunschweig
Bueltenweg 74/75
38106 Braunschweig, Germany
Phone: +49 531 391-3289
EMail: schoenw@ibr.cs.tu-bs.de

Send comments to &lt;mibs@ops.ietf.org&gt;.</ContactInfo>
      <Description>This MIB module provides commonly used transport
address definitions.

Copyright (C) The Internet Society (2002). This version of
this MIB module is part of RFC 3419; see the RFC itself for
full legal notices.</Description>
   </ModuleIdentity>
   <Oid name="transportDomains" oid="1.3.6.1.2.1.100.1" />
   <Oid name="transportDomainUdpIpv4" oid="1.3.6.1.2.1.100.1.1" />
   <Oid name="transportDomainUdpIpv6" oid="1.3.6.1.2.1.100.1.2" />
   <Oid name="transportDomainUdpIpv4z" oid="1.3.6.1.2.1.100.1.3" />
   <Oid name="transportDomainUdpIpv6z" oid="1.3.6.1.2.1.100.1.4" />
   <Oid name="transportDomainTcpIpv4" oid="1.3.6.1.2.1.100.1.5" />
   <Oid name="transportDomainTcpIpv6" oid="1.3.6.1.2.1.100.1.6" />
   <Oid name="transportDomainTcpIpv4z" oid="1.3.6.1.2.1.100.1.7" />
   <Oid name="transportDomainTcpIpv6z" oid="1.3.6.1.2.1.100.1.8" />
   <Oid name="transportDomainSctpIpv4" oid="1.3.6.1.2.1.100.1.9" />
   <Oid name="transportDomainSctpIpv6" oid="1.3.6.1.2.1.100.1.10" />
   <Oid name="transportDomainSctpIpv4z" oid="1.3.6.1.2.1.100.1.11" />
   <Oid name="transportDomainSctpIpv6z" oid="1.3.6.1.2.1.100.1.12" />
   <Oid name="transportDomainLocal" oid="1.3.6.1.2.1.100.1.13" />
   <Oid name="transportDomainUdpDns" oid="1.3.6.1.2.1.100.1.14" />
   <Oid name="transportDomainTcpDns" oid="1.3.6.1.2.1.100.1.15" />
   <Oid name="transportDomainSctpDns" oid="1.3.6.1.2.1.100.1.16" />
   <Type name="TransportDomain" type="OBJECT IDENTIFIER" objtype="o" status="current" />
   <Type name="TransportAddressType" type="INTEGER" objtype="i" status="current">
      <NamedNumberList>
         <nn name="unknown" value="0" />
         <nn name="udpIpv4" value="1" />
         <nn name="udpIpv6" value="2" />
         <nn name="udpIpv4z" value="3" />
         <nn name="udpIpv6z" value="4" />
         <nn name="tcpIpv4" value="5" />
         <nn name="tcpIpv6" value="6" />
         <nn name="tcpIpv4z" value="7" />
         <nn name="tcpIpv6z" value="8" />
         <nn name="sctpIpv4" value="9" />
         <nn name="sctpIpv6" value="10" />
         <nn name="sctpIpv4z" value="11" />
         <nn name="sctpIpv6z" value="12" />
         <nn name="local" value="13" />
         <nn name="udpDns" value="14" />
         <nn name="tcpDns" value="15" />
         <nn name="sctpDns" value="16" />
      </NamedNumberList>
   </Type>
   <Type name="TransportAddress" type="OCTET STRING" objtype="s" status="current">
      <Size>
         <RangeSpec>
            <RangeItem lower="0" upper="255" />
         </RangeSpec>
      </Size>
   </Type>
   <Type name="TransportAddressIPv4" type="OCTET STRING" objtype="s" displayHint="1d.1d.1d.1d:2d" status="current">
      <Size>
         <RangeSpec>
            <RangeItem single="6" />
         </RangeSpec>
      </Size>
   </Type>
   <Type name="TransportAddressIPv6" type="OCTET STRING" objtype="s" displayHint="0a[2x:2x:2x:2x:2x:2x:2x:2x]0a:2d" status="current">
      <Size>
         <RangeSpec>
            <RangeItem single="18" />
         </RangeSpec>
      </Size>
   </Type>
   <Type name="TransportAddressIPv4z" type="OCTET STRING" objtype="s" displayHint="1d.1d.1d.1d%4d:2d" status="current">
      <Size>
         <RangeSpec>
            <RangeItem single="10" />
         </RangeSpec>
      </Size>
   </Type>
   <Type name="TransportAddressIPv6z" type="OCTET STRING" objtype="s" displayHint="0a[2x:2x:2x:2x:2x:2x:2x:2x%4d]0a:2d" status="current">
      <Size>
         <RangeSpec>
            <RangeItem single="22" />
         </RangeSpec>
      </Size>
   </Type>
   <Type name="TransportAddressLocal" type="OCTET STRING" objtype="s" displayHint="1a" status="current">
      <Size>
         <RangeSpec>
            <RangeItem lower="1" upper="255" />
         </RangeSpec>
      </Size>
   </Type>
   <Type name="TransportAddressDns" type="OCTET STRING" objtype="s" displayHint="1a" status="current">
      <Size>
         <RangeSpec>
            <RangeItem lower="1" upper="255" />
         </RangeSpec>
      </Size>
   </Type>
</Module>

