<?xml version="1.0" encoding="UTF-8"?>
<!DOCTYPE ModuleList SYSTEM "http://www.monfox.com/monfox/toolkit/snmp/dtd/snmpMetadata.dtd">
<ModuleList>
   <ModuleRef name="IANAifType-MIB"/>
   <ModuleRef name="IF-MIB"/>
   <ModuleRef name="TCP-MIB"/>
   <ModuleRef name="RFC1155-MIB"/>
   <ModuleRef name="RFC1213-MIB"/>
   <ModuleRef name="SNMPv2-CONF"/>
   <ModuleRef name="SNMPv2-MIB"/>
   <ModuleRef name="SNMPv2-SMI"/>
   <ModuleRef name="SNMPv2-TC"/>
   <ModuleRef name="SNMPv2-TM"/>
   <ModuleRef name="SNMP-FRAMEWORK-MIB"/>
   <ModuleRef name="SNMP-NOTIFICATION-MIB"/>
   <ModuleRef name="SNMP-REPEATER-MIB"/>
   <ModuleRef name="SNMP-TARGET-MIB"/>
   <ModuleRef name="SNMP-USER-BASED-SM-MIB"/>
   <ModuleRef name="SNMP-VIEW-BASED-ACM-MIB"/>
</ModuleList>
