<?xml version="1.0" encoding="UTF-8"?>
<!DOCTYPE Module SYSTEM "http://www.monfox.com/monfox/toolkit/snmp/dtd/snmpMetadata.dtd">
<!--This is an automatically generated file.-->
<!--Do not Edit!-->
<!--[Thu Aug 10 08:11:58 EDT 2017]-->
<Module name="TCP-MIB">
   <Requires />
   <ModuleIdentity name="tcpMIB" oid="1.3.6.1.2.1.49" lastUpdated="9411010000Z">
      <Organization>IETF SNMPv2 Working Group</Organization>
      <ContactInfo>Keith McCloghrie

Postal: Cisco Systems, Inc.
        170 West Tasman Drive
        San Jose, CA  95134-1706
        US

Phone:  +1 408 526 5260
Email:  kzm@cisco.com</ContactInfo>
      <Description>The MIB module for managing TCP implementations.</Description>
   </ModuleIdentity>
   <Oid name="tcp" oid="1.3.6.1.2.1.6" />
   <Object name="tcpRtoAlgorithm" oid="1.3.6.1.2.1.6.1" objtype="i" smitype="i" access="ro" form="scalar" status="current">
      <NamedNumberList>
         <nn name="other" value="1" />
         <nn name="constant" value="2" />
         <nn name="rsre" value="3" />
         <nn name="vanj" value="4" />
      </NamedNumberList>
   </Object>
   <Object name="tcpRtoMin" oid="1.3.6.1.2.1.6.2" objtype="i" smitype="i32" access="ro" form="scalar" status="current" />
   <Object name="tcpRtoMax" oid="1.3.6.1.2.1.6.3" objtype="i" smitype="i32" access="ro" form="scalar" status="current" />
   <Object name="tcpMaxConn" oid="1.3.6.1.2.1.6.4" objtype="i" smitype="i32" access="ro" form="scalar" status="current" />
   <Object name="tcpActiveOpens" oid="1.3.6.1.2.1.6.5" objtype="c" smitype="c32" access="ro" form="scalar" status="current" />
   <Object name="tcpPassiveOpens" oid="1.3.6.1.2.1.6.6" objtype="c" smitype="c32" access="ro" form="scalar" status="current" />
   <Object name="tcpAttemptFails" oid="1.3.6.1.2.1.6.7" objtype="c" smitype="c32" access="ro" form="scalar" status="current" />
   <Object name="tcpEstabResets" oid="1.3.6.1.2.1.6.8" objtype="c" smitype="c32" access="ro" form="scalar" status="current" />
   <Object name="tcpCurrEstab" oid="1.3.6.1.2.1.6.9" objtype="g" smitype="g32" access="ro" form="scalar" status="current" />
   <Object name="tcpInSegs" oid="1.3.6.1.2.1.6.10" objtype="c" smitype="c32" access="ro" form="scalar" status="current" />
   <Object name="tcpOutSegs" oid="1.3.6.1.2.1.6.11" objtype="c" smitype="c32" access="ro" form="scalar" status="current" />
   <Object name="tcpRetransSegs" oid="1.3.6.1.2.1.6.12" objtype="c" smitype="c32" access="ro" form="scalar" status="current" />
   <Table name="tcpConnTable" oid="1.3.6.1.2.1.6.13" status="current">
      <Entry name="tcpConnEntry" oid="1.3.6.1.2.1.6.13.1" status="current">
         <Indexes>
            <ObjectRef name="tcpConnLocalAddress" />
            <ObjectRef name="tcpConnLocalPort" />
            <ObjectRef name="tcpConnRemAddress" />
            <ObjectRef name="tcpConnRemPort" />
         </Indexes>
         <Column name="tcpConnState" column="1" objtype="i" />
         <Column name="tcpConnLocalAddress" column="2" objtype="ip" />
         <Column name="tcpConnLocalPort" column="3" objtype="i" />
         <Column name="tcpConnRemAddress" column="4" objtype="ip" />
         <Column name="tcpConnRemPort" column="5" objtype="i" />
      </Entry>
   </Table>
   <Object name="tcpConnEntry" oid="1.3.6.1.2.1.6.13.1" objtype="entry" smitype="entry" access="na" typeref="TCP-MIB:TcpConnEntry" form="entry" status="current" />
   <Type name="TcpConnEntry" type="SEQUENCE" objtype="entry" />
   <Object name="tcpConnState" oid="1.3.6.1.2.1.6.13.1.1" objtype="i" smitype="i" access="rw" form="column" status="current">
      <NamedNumberList>
         <nn name="closed" value="1" />
         <nn name="listen" value="2" />
         <nn name="synSent" value="3" />
         <nn name="synReceived" value="4" />
         <nn name="established" value="5" />
         <nn name="finWait1" value="6" />
         <nn name="finWait2" value="7" />
         <nn name="closeWait" value="8" />
         <nn name="lastAck" value="9" />
         <nn name="closing" value="10" />
         <nn name="timeWait" value="11" />
         <nn name="deleteTCB" value="12" />
      </NamedNumberList>
   </Object>
   <Object name="tcpConnLocalAddress" oid="1.3.6.1.2.1.6.13.1.2" objtype="ip" smitype="ip" access="ro" form="column" status="current" />
   <Object name="tcpConnLocalPort" oid="1.3.6.1.2.1.6.13.1.3" objtype="i" smitype="i" access="ro" form="column" status="current">
      <RangeSpec>
         <RangeItem lower="0" upper="65535" />
      </RangeSpec>
   </Object>
   <Object name="tcpConnRemAddress" oid="1.3.6.1.2.1.6.13.1.4" objtype="ip" smitype="ip" access="ro" form="column" status="current" />
   <Object name="tcpConnRemPort" oid="1.3.6.1.2.1.6.13.1.5" objtype="i" smitype="i" access="ro" form="column" status="current">
      <RangeSpec>
         <RangeItem lower="0" upper="65535" />
      </RangeSpec>
   </Object>
   <Object name="tcpInErrs" oid="1.3.6.1.2.1.6.14" objtype="c" smitype="c32" access="ro" form="scalar" status="current" />
   <Object name="tcpOutRsts" oid="1.3.6.1.2.1.6.15" objtype="c" smitype="c32" access="ro" form="scalar" status="current" />
   <Oid name="tcpMIBConformance" oid="1.3.6.1.2.1.49.2" />
   <Oid name="tcpMIBCompliances" oid="1.3.6.1.2.1.49.2.1" />
   <Oid name="tcpMIBGroups" oid="1.3.6.1.2.1.49.2.2" />
   <ModuleCompliance name="tcpMIBCompliance" oid="1.3.6.1.2.1.49.2.1.1" status="current">
      <McModule>
         <MandatoryGroups>
            <GroupRef name="tcpGroup" />
         </MandatoryGroups>
      </McModule>
   </ModuleCompliance>
   <ObjectGroup name="tcpGroup" oid="1.3.6.1.2.1.49.2.2.1" status="current">
      <Objects>
         <ObjectRef name="tcpRtoAlgorithm" />
         <ObjectRef name="tcpRtoMin" />
         <ObjectRef name="tcpRtoMax" />
         <ObjectRef name="tcpMaxConn" />
         <ObjectRef name="tcpActiveOpens" />
         <ObjectRef name="tcpPassiveOpens" />
         <ObjectRef name="tcpAttemptFails" />
         <ObjectRef name="tcpEstabResets" />
         <ObjectRef name="tcpCurrEstab" />
         <ObjectRef name="tcpInSegs" />
         <ObjectRef name="tcpOutSegs" />
         <ObjectRef name="tcpRetransSegs" />
         <ObjectRef name="tcpConnState" />
         <ObjectRef name="tcpConnLocalAddress" />
         <ObjectRef name="tcpConnLocalPort" />
         <ObjectRef name="tcpConnRemAddress" />
         <ObjectRef name="tcpConnRemPort" />
         <ObjectRef name="tcpInErrs" />
         <ObjectRef name="tcpOutRsts" />
      </Objects>
   </ObjectGroup>
</Module>

