<?xml version="1.0" encoding="UTF-8"?>
<!DOCTYPE Module SYSTEM "http://www.monfox.com/monfox/toolkit/snmp/dtd/snmpMetadata.dtd">
<!--This is an automatically generated file.-->
<!--Do not Edit!-->
<!--[Thu Aug 10 08:12:04 EDT 2017]-->
<Module name="RFC1155-SMI">
   <Requires />
   <Oid name="ccitt" oid="0" />
   <Oid name="null" oid="0.0" />
   <Oid name="iso" oid="1" />
   <Oid name="org" oid="1.3" />
   <Oid name="dod" oid="1.3.6" />
   <Oid name="internet" oid="1.3.6.1" />
   <Oid name="directory" oid="1.3.6.1.1" />
   <Oid name="mgmt" oid="1.3.6.1.2" />
   <Oid name="experimental" oid="1.3.6.1.3" />
   <Oid name="private" oid="1.3.6.1.4" />
   <Oid name="enterprises" oid="1.3.6.1.4.1" />
</Module>

