<?xml version="1.0" encoding="UTF-8"?>
<!DOCTYPE Module SYSTEM "http://www.monfox.com/monfox/toolkit/snmp/dtd/snmpMetadata.dtd">
<!--This is an automatically generated file.-->
<!--Do not Edit!-->
<!--[Thu Aug 10 08:11:58 EDT 2017]-->
<Module name="SNMPv2-TM">
   <Requires />
   <Oid name="snmpUDPDomain" oid="1.3.6.1.6.1.1" />
   <Type name="SnmpUDPAddress" type="OCTET STRING" objtype="s" displayHint="1d.1d.1d.1d/2d" status="current">
      <Size>
         <RangeSpec>
            <RangeItem single="6" />
         </RangeSpec>
      </Size>
   </Type>
   <Oid name="snmpCLNSDomain" oid="1.3.6.1.6.1.2" />
   <Oid name="snmpCONSDomain" oid="1.3.6.1.6.1.3" />
   <Type name="SnmpOSIAddress" type="OCTET STRING" objtype="s" displayHint="*1x:/1x:" status="current">
      <Size>
         <RangeSpec>
            <RangeItem single="1" />
            <RangeItem lower="4" upper="85" />
         </RangeSpec>
      </Size>
   </Type>
   <Oid name="snmpDDPDomain" oid="1.3.6.1.6.1.4" />
   <Type name="SnmpNBPAddress" type="OCTET STRING" objtype="s" status="current">
      <Size>
         <RangeSpec>
            <RangeItem lower="3" upper="99" />
         </RangeSpec>
      </Size>
   </Type>
   <Oid name="snmpIPXDomain" oid="1.3.6.1.6.1.5" />
   <Type name="SnmpIPXAddress" type="OCTET STRING" objtype="s" displayHint="4x.1x:1x:1x:1x:1x:1x.2d" status="current">
      <Size>
         <RangeSpec>
            <RangeItem single="12" />
         </RangeSpec>
      </Size>
   </Type>
   <Oid name="rfc1157Proxy" oid="1.3.6.1.6.2.1" />
   <Oid name="rfc1157Domain" oid="1.3.6.1.6.2.1.1" />
</Module>

